{
  "provider": "auritus",
  "voice": "kokoro:af_heart",
  "speed": 1,
  "seed": 0,
  "sampleRateHz": 24000,
  "pauseBetweenItems": {
    "mode": "gaussian",
    "mean": 0.2,
    "std": 0.05,
    "min": 0,
    "max": 1
  },
  "pronunciations": [
    {
      "grapheme": "VideoML",
      "alias": "video em el"
    }
  ]
}
